{
  "$schema": "https://json-schema.org/draft/2020-12/schema",
  "$id": "https://github.com/kmay89/civica/blob/main/SPEC/refusal.schema.json",
  "title": "Civica refusal record (spec 0.1)",
  "description": "The record a Civica-aligned system writes when it refuses (PROTOCOLS/REFUSAL.md, Article I). It carries the boundary and the category, never the request: there is no field for raw content and no additional properties are allowed, so a record that stores the prompt does not validate.",
  "type": "object",
  "additionalProperties": false,
  "required": [
    "record_type",
    "spec_version",
    "time",
    "system_id",
    "purpose_id",
    "category",
    "article_ids",
    "request_hash",
    "boundary",
    "action",
    "alternative",
    "raw_content_stored"
  ],
  "properties": {
    "record_type": { "const": "civica.refusal" },
    "spec_version": { "const": "0.1" },
    "time": { "type": "string", "format": "date-time" },
    "system_id": { "type": "string", "minLength": 1 },
    "purpose_id": {
      "type": "string",
      "minLength": 1,
      "description": "Must match the purpose_id of a civica.purpose record in the same set."
    },
    "category": {
      "enum": ["scope", "purpose", "harm", "uncertainty", "safeguard", "pressure"],
      "description": "The refusal condition from PROTOCOLS/REFUSAL.md: exceeds scope; conflicts with purpose; risks harm or coercion; lacks context; attempts to remove safeguards; pressures the system to bypass limits."
    },
    "article_ids": {
      "type": "array",
      "minItems": 1,
      "uniqueItems": true,
      "items": { "enum": ["I", "II", "III", "IV", "V", "VI", "VII", "VIII", "IX", "X"] },
      "description": "Articles of CORE/BILL_OF_RIGHTS.md the refusal rests on. A refusal that cites no article is not a Civica refusal."
    },
    "request_hash": {
      "type": "string",
      "pattern": "^sha256:[0-9a-f]{64}$",
      "description": "SHA-256 of the request, lowercase hex, prefixed. Hash the request text alone or with a per-system salt; the record must let an auditor confirm a repeated request without letting anyone read it."
    },
    "boundary": {
      "type": "string",
      "minLength": 1,
      "maxLength": 280,
      "description": "The limit that was hit, stated structurally. Not a quotation of the request, not a feeling."
    },
    "action": { "const": "refused" },
    "alternative": {
      "type": ["string", "null"],
      "maxLength": 280,
      "description": "Escalation path or safer next step offered, or null if none."
    },
    "raw_content_stored": {
      "const": false,
      "description": "Always false. The record stores the hash, not the request."
    }
  }
}
